{
  "adapter_id": "aaaaaaaaaaaaaaaaaaaaaaaaaaaaaaaaaaaaaaaaaaaaaaaaaaaaaaaaaaaaaaaa",
  "original_artifacts_relabelled": false,
  "registration_id": "aaaaaaaaaaaaaaaaaaaaaaaaaaaaaaaaaaaaaaaaaaaaaaaaaaaaaaaaaaaaaaaa",
  "schema_version": "h4l-mass-off-compatibility-audit-v1",
  "semantics": {
    "bundles_digest": "aaaaaaaaaaaaaaaaaaaaaaaaaaaaaaaaaaaaaaaaaaaaaaaaaaaaaaaaaaaaaaaa",
    "candidate_keys": [
      "M0off:42",
      "M3:42:groups=A:m4l=off",
      "M3:42:groups=B:m4l=off",
      "M3:42:groups=C:m4l=off",
      "M3:42:groups=D:m4l=off",
      "M3:42:groups=AB:m4l=off",
      "M3:42:groups=AC:m4l=off",
      "M3:42:groups=AD:m4l=off",
      "M3:42:groups=BC:m4l=off",
      "M3:42:groups=BD:m4l=off",
      "M3:42:groups=CD:m4l=off",
      "M3:42:groups=ABC:m4l=off",
      "M3:42:groups=ABD:m4l=off",
      "M3:42:groups=ACD:m4l=off",
      "M3:42:groups=BCD:m4l=off",
      "M3:42:groups=ABCD:m4l=off",
      "M0off:43",
      "M3:43:groups=A:m4l=off",
      "M3:43:groups=B:m4l=off",
      "M3:43:groups=C:m4l=off",
      "M3:43:groups=D:m4l=off",
      "M3:43:groups=AB:m4l=off",
      "M3:43:groups=AC:m4l=off",
      "M3:43:groups=AD:m4l=off",
      "M3:43:groups=BC:m4l=off",
      "M3:43:groups=BD:m4l=off",
      "M3:43:groups=CD:m4l=off",
      "M3:43:groups=ABC:m4l=off",
      "M3:43:groups=ABD:m4l=off",
      "M3:43:groups=ACD:m4l=off",
      "M3:43:groups=BCD:m4l=off",
      "M3:43:groups=ABCD:m4l=off",
      "M0off:44",
      "M3:44:groups=A:m4l=off",
      "M3:44:groups=B:m4l=off",
      "M3:44:groups=C:m4l=off",
      "M3:44:groups=D:m4l=off",
      "M3:44:groups=AB:m4l=off",
      "M3:44:groups=AC:m4l=off",
      "M3:44:groups=AD:m4l=off",
      "M3:44:groups=BC:m4l=off",
      "M3:44:groups=BD:m4l=off",
      "M3:44:groups=CD:m4l=off",
      "M3:44:groups=ABC:m4l=off",
      "M3:44:groups=ABD:m4l=off",
      "M3:44:groups=ACD:m4l=off",
      "M3:44:groups=BCD:m4l=off",
      "M3:44:groups=ABCD:m4l=off",
      "M0off:45",
      "M3:45:groups=A:m4l=off",
      "M3:45:groups=B:m4l=off",
      "M3:45:groups=C:m4l=off",
      "M3:45:groups=D:m4l=off",
      "M3:45:groups=AB:m4l=off",
      "M3:45:groups=AC:m4l=off",
      "M3:45:groups=AD:m4l=off",
      "M3:45:groups=BC:m4l=off",
      "M3:45:groups=BD:m4l=off",
      "M3:45:groups=CD:m4l=off",
      "M3:45:groups=ABC:m4l=off",
      "M3:45:groups=ABD:m4l=off",
      "M3:45:groups=ACD:m4l=off",
      "M3:45:groups=BCD:m4l=off",
      "M3:45:groups=ABCD:m4l=off",
      "M0off:46",
      "M3:46:groups=A:m4l=off",
      "M3:46:groups=B:m4l=off",
      "M3:46:groups=C:m4l=off",
      "M3:46:groups=D:m4l=off",
      "M3:46:groups=AB:m4l=off",
      "M3:46:groups=AC:m4l=off",
      "M3:46:groups=AD:m4l=off",
      "M3:46:groups=BC:m4l=off",
      "M3:46:groups=BD:m4l=off",
      "M3:46:groups=CD:m4l=off",
      "M3:46:groups=ABC:m4l=off",
      "M3:46:groups=ABD:m4l=off",
      "M3:46:groups=ACD:m4l=off",
      "M3:46:groups=BCD:m4l=off",
      "M3:46:groups=ABCD:m4l=off"
    ],
    "development_probability": 0.8,
    "estimator": "per_seed_then_median",
    "mapping_digests": {
      "M0off:42": "aaaaaaaaaaaaaaaaaaaaaaaaaaaaaaaaaaaaaaaaaaaaaaaaaaaaaaaaaaaaaaaa",
      "M0off:43": "aaaaaaaaaaaaaaaaaaaaaaaaaaaaaaaaaaaaaaaaaaaaaaaaaaaaaaaaaaaaaaaa",
      "M0off:44": "aaaaaaaaaaaaaaaaaaaaaaaaaaaaaaaaaaaaaaaaaaaaaaaaaaaaaaaaaaaaaaaa",
      "M0off:45": "aaaaaaaaaaaaaaaaaaaaaaaaaaaaaaaaaaaaaaaaaaaaaaaaaaaaaaaaaaaaaaaa",
      "M0off:46": "aaaaaaaaaaaaaaaaaaaaaaaaaaaaaaaaaaaaaaaaaaaaaaaaaaaaaaaaaaaaaaaa",
      "M3:42:groups=A:m4l=off": "aaaaaaaaaaaaaaaaaaaaaaaaaaaaaaaaaaaaaaaaaaaaaaaaaaaaaaaaaaaaaaaa",
      "M3:42:groups=AB:m4l=off": "aaaaaaaaaaaaaaaaaaaaaaaaaaaaaaaaaaaaaaaaaaaaaaaaaaaaaaaaaaaaaaaa",
      "M3:42:groups=ABC:m4l=off": "aaaaaaaaaaaaaaaaaaaaaaaaaaaaaaaaaaaaaaaaaaaaaaaaaaaaaaaaaaaaaaaa",
      "M3:42:groups=ABCD:m4l=off": "aaaaaaaaaaaaaaaaaaaaaaaaaaaaaaaaaaaaaaaaaaaaaaaaaaaaaaaaaaaaaaaa",
      "M3:42:groups=ABD:m4l=off": "aaaaaaaaaaaaaaaaaaaaaaaaaaaaaaaaaaaaaaaaaaaaaaaaaaaaaaaaaaaaaaaa",
      "M3:42:groups=AC:m4l=off": "aaaaaaaaaaaaaaaaaaaaaaaaaaaaaaaaaaaaaaaaaaaaaaaaaaaaaaaaaaaaaaaa",
      "M3:42:groups=ACD:m4l=off": "aaaaaaaaaaaaaaaaaaaaaaaaaaaaaaaaaaaaaaaaaaaaaaaaaaaaaaaaaaaaaaaa",
      "M3:42:groups=AD:m4l=off": "aaaaaaaaaaaaaaaaaaaaaaaaaaaaaaaaaaaaaaaaaaaaaaaaaaaaaaaaaaaaaaaa",
      "M3:42:groups=B:m4l=off": "aaaaaaaaaaaaaaaaaaaaaaaaaaaaaaaaaaaaaaaaaaaaaaaaaaaaaaaaaaaaaaaa",
      "M3:42:groups=BC:m4l=off": "aaaaaaaaaaaaaaaaaaaaaaaaaaaaaaaaaaaaaaaaaaaaaaaaaaaaaaaaaaaaaaaa",
      "M3:42:groups=BCD:m4l=off": "aaaaaaaaaaaaaaaaaaaaaaaaaaaaaaaaaaaaaaaaaaaaaaaaaaaaaaaaaaaaaaaa",
      "M3:42:groups=BD:m4l=off": "aaaaaaaaaaaaaaaaaaaaaaaaaaaaaaaaaaaaaaaaaaaaaaaaaaaaaaaaaaaaaaaa",
      "M3:42:groups=C:m4l=off": "aaaaaaaaaaaaaaaaaaaaaaaaaaaaaaaaaaaaaaaaaaaaaaaaaaaaaaaaaaaaaaaa",
      "M3:42:groups=CD:m4l=off": "aaaaaaaaaaaaaaaaaaaaaaaaaaaaaaaaaaaaaaaaaaaaaaaaaaaaaaaaaaaaaaaa",
      "M3:42:groups=D:m4l=off": "aaaaaaaaaaaaaaaaaaaaaaaaaaaaaaaaaaaaaaaaaaaaaaaaaaaaaaaaaaaaaaaa",
      "M3:43:groups=A:m4l=off": "aaaaaaaaaaaaaaaaaaaaaaaaaaaaaaaaaaaaaaaaaaaaaaaaaaaaaaaaaaaaaaaa",
      "M3:43:groups=AB:m4l=off": "aaaaaaaaaaaaaaaaaaaaaaaaaaaaaaaaaaaaaaaaaaaaaaaaaaaaaaaaaaaaaaaa",
      "M3:43:groups=ABC:m4l=off": "aaaaaaaaaaaaaaaaaaaaaaaaaaaaaaaaaaaaaaaaaaaaaaaaaaaaaaaaaaaaaaaa",
      "M3:43:groups=ABCD:m4l=off": "aaaaaaaaaaaaaaaaaaaaaaaaaaaaaaaaaaaaaaaaaaaaaaaaaaaaaaaaaaaaaaaa",
      "M3:43:groups=ABD:m4l=off": "aaaaaaaaaaaaaaaaaaaaaaaaaaaaaaaaaaaaaaaaaaaaaaaaaaaaaaaaaaaaaaaa",
      "M3:43:groups=AC:m4l=off": "aaaaaaaaaaaaaaaaaaaaaaaaaaaaaaaaaaaaaaaaaaaaaaaaaaaaaaaaaaaaaaaa",
      "M3:43:groups=ACD:m4l=off": "aaaaaaaaaaaaaaaaaaaaaaaaaaaaaaaaaaaaaaaaaaaaaaaaaaaaaaaaaaaaaaaa",
      "M3:43:groups=AD:m4l=off": "aaaaaaaaaaaaaaaaaaaaaaaaaaaaaaaaaaaaaaaaaaaaaaaaaaaaaaaaaaaaaaaa",
      "M3:43:groups=B:m4l=off": "aaaaaaaaaaaaaaaaaaaaaaaaaaaaaaaaaaaaaaaaaaaaaaaaaaaaaaaaaaaaaaaa",
      "M3:43:groups=BC:m4l=off": "aaaaaaaaaaaaaaaaaaaaaaaaaaaaaaaaaaaaaaaaaaaaaaaaaaaaaaaaaaaaaaaa",
      "M3:43:groups=BCD:m4l=off": "aaaaaaaaaaaaaaaaaaaaaaaaaaaaaaaaaaaaaaaaaaaaaaaaaaaaaaaaaaaaaaaa",
      "M3:43:groups=BD:m4l=off": "aaaaaaaaaaaaaaaaaaaaaaaaaaaaaaaaaaaaaaaaaaaaaaaaaaaaaaaaaaaaaaaa",
      "M3:43:groups=C:m4l=off": "aaaaaaaaaaaaaaaaaaaaaaaaaaaaaaaaaaaaaaaaaaaaaaaaaaaaaaaaaaaaaaaa",
      "M3:43:groups=CD:m4l=off": "aaaaaaaaaaaaaaaaaaaaaaaaaaaaaaaaaaaaaaaaaaaaaaaaaaaaaaaaaaaaaaaa",
      "M3:43:groups=D:m4l=off": "aaaaaaaaaaaaaaaaaaaaaaaaaaaaaaaaaaaaaaaaaaaaaaaaaaaaaaaaaaaaaaaa",
      "M3:44:groups=A:m4l=off": "aaaaaaaaaaaaaaaaaaaaaaaaaaaaaaaaaaaaaaaaaaaaaaaaaaaaaaaaaaaaaaaa",
      "M3:44:groups=AB:m4l=off": "aaaaaaaaaaaaaaaaaaaaaaaaaaaaaaaaaaaaaaaaaaaaaaaaaaaaaaaaaaaaaaaa",
      "M3:44:groups=ABC:m4l=off": "aaaaaaaaaaaaaaaaaaaaaaaaaaaaaaaaaaaaaaaaaaaaaaaaaaaaaaaaaaaaaaaa",
      "M3:44:groups=ABCD:m4l=off": "aaaaaaaaaaaaaaaaaaaaaaaaaaaaaaaaaaaaaaaaaaaaaaaaaaaaaaaaaaaaaaaa",
      "M3:44:groups=ABD:m4l=off": "aaaaaaaaaaaaaaaaaaaaaaaaaaaaaaaaaaaaaaaaaaaaaaaaaaaaaaaaaaaaaaaa",
      "M3:44:groups=AC:m4l=off": "aaaaaaaaaaaaaaaaaaaaaaaaaaaaaaaaaaaaaaaaaaaaaaaaaaaaaaaaaaaaaaaa",
      "M3:44:groups=ACD:m4l=off": "aaaaaaaaaaaaaaaaaaaaaaaaaaaaaaaaaaaaaaaaaaaaaaaaaaaaaaaaaaaaaaaa",
      "M3:44:groups=AD:m4l=off": "aaaaaaaaaaaaaaaaaaaaaaaaaaaaaaaaaaaaaaaaaaaaaaaaaaaaaaaaaaaaaaaa",
      "M3:44:groups=B:m4l=off": "aaaaaaaaaaaaaaaaaaaaaaaaaaaaaaaaaaaaaaaaaaaaaaaaaaaaaaaaaaaaaaaa",
      "M3:44:groups=BC:m4l=off": "aaaaaaaaaaaaaaaaaaaaaaaaaaaaaaaaaaaaaaaaaaaaaaaaaaaaaaaaaaaaaaaa",
      "M3:44:groups=BCD:m4l=off": "aaaaaaaaaaaaaaaaaaaaaaaaaaaaaaaaaaaaaaaaaaaaaaaaaaaaaaaaaaaaaaaa",
      "M3:44:groups=BD:m4l=off": "aaaaaaaaaaaaaaaaaaaaaaaaaaaaaaaaaaaaaaaaaaaaaaaaaaaaaaaaaaaaaaaa",
      "M3:44:groups=C:m4l=off": "aaaaaaaaaaaaaaaaaaaaaaaaaaaaaaaaaaaaaaaaaaaaaaaaaaaaaaaaaaaaaaaa",
      "M3:44:groups=CD:m4l=off": "aaaaaaaaaaaaaaaaaaaaaaaaaaaaaaaaaaaaaaaaaaaaaaaaaaaaaaaaaaaaaaaa",
      "M3:44:groups=D:m4l=off": "aaaaaaaaaaaaaaaaaaaaaaaaaaaaaaaaaaaaaaaaaaaaaaaaaaaaaaaaaaaaaaaa",
      "M3:45:groups=A:m4l=off": "aaaaaaaaaaaaaaaaaaaaaaaaaaaaaaaaaaaaaaaaaaaaaaaaaaaaaaaaaaaaaaaa",
      "M3:45:groups=AB:m4l=off": "aaaaaaaaaaaaaaaaaaaaaaaaaaaaaaaaaaaaaaaaaaaaaaaaaaaaaaaaaaaaaaaa",
      "M3:45:groups=ABC:m4l=off": "aaaaaaaaaaaaaaaaaaaaaaaaaaaaaaaaaaaaaaaaaaaaaaaaaaaaaaaaaaaaaaaa",
      "M3:45:groups=ABCD:m4l=off": "aaaaaaaaaaaaaaaaaaaaaaaaaaaaaaaaaaaaaaaaaaaaaaaaaaaaaaaaaaaaaaaa",
      "M3:45:groups=ABD:m4l=off": "aaaaaaaaaaaaaaaaaaaaaaaaaaaaaaaaaaaaaaaaaaaaaaaaaaaaaaaaaaaaaaaa",
      "M3:45:groups=AC:m4l=off": "aaaaaaaaaaaaaaaaaaaaaaaaaaaaaaaaaaaaaaaaaaaaaaaaaaaaaaaaaaaaaaaa",
      "M3:45:groups=ACD:m4l=off": "aaaaaaaaaaaaaaaaaaaaaaaaaaaaaaaaaaaaaaaaaaaaaaaaaaaaaaaaaaaaaaaa",
      "M3:45:groups=AD:m4l=off": "aaaaaaaaaaaaaaaaaaaaaaaaaaaaaaaaaaaaaaaaaaaaaaaaaaaaaaaaaaaaaaaa",
      "M3:45:groups=B:m4l=off": "aaaaaaaaaaaaaaaaaaaaaaaaaaaaaaaaaaaaaaaaaaaaaaaaaaaaaaaaaaaaaaaa",
      "M3:45:groups=BC:m4l=off": "aaaaaaaaaaaaaaaaaaaaaaaaaaaaaaaaaaaaaaaaaaaaaaaaaaaaaaaaaaaaaaaa",
      "M3:45:groups=BCD:m4l=off": "aaaaaaaaaaaaaaaaaaaaaaaaaaaaaaaaaaaaaaaaaaaaaaaaaaaaaaaaaaaaaaaa",
      "M3:45:groups=BD:m4l=off": "aaaaaaaaaaaaaaaaaaaaaaaaaaaaaaaaaaaaaaaaaaaaaaaaaaaaaaaaaaaaaaaa",
      "M3:45:groups=C:m4l=off": "aaaaaaaaaaaaaaaaaaaaaaaaaaaaaaaaaaaaaaaaaaaaaaaaaaaaaaaaaaaaaaaa",
      "M3:45:groups=CD:m4l=off": "aaaaaaaaaaaaaaaaaaaaaaaaaaaaaaaaaaaaaaaaaaaaaaaaaaaaaaaaaaaaaaaa",
      "M3:45:groups=D:m4l=off": "aaaaaaaaaaaaaaaaaaaaaaaaaaaaaaaaaaaaaaaaaaaaaaaaaaaaaaaaaaaaaaaa",
      "M3:46:groups=A:m4l=off": "aaaaaaaaaaaaaaaaaaaaaaaaaaaaaaaaaaaaaaaaaaaaaaaaaaaaaaaaaaaaaaaa",
      "M3:46:groups=AB:m4l=off": "aaaaaaaaaaaaaaaaaaaaaaaaaaaaaaaaaaaaaaaaaaaaaaaaaaaaaaaaaaaaaaaa",
      "M3:46:groups=ABC:m4l=off": "aaaaaaaaaaaaaaaaaaaaaaaaaaaaaaaaaaaaaaaaaaaaaaaaaaaaaaaaaaaaaaaa",
      "M3:46:groups=ABCD:m4l=off": "aaaaaaaaaaaaaaaaaaaaaaaaaaaaaaaaaaaaaaaaaaaaaaaaaaaaaaaaaaaaaaaa",